{
  "version": "v1",
  "note": "Task anchors and worked course templates. Templates are starting points for syllabus design, to be adapted after local needs analysis; they are not validated course designs.",
  "anchorCount": 9,
  "templateCount": 7,
  "taskAnchors": [
    {
      "id": "extended-source-based-project",
      "name": "Extended source-based project",
      "description": "Learners research and write a 2,000–4,000-word essay or report on a focused question in or near their field, using sources they have found and evaluated themselves. It is developed through staged submissions (topic plan, annotated sources, drafts discussed in tutorials) and is usually marked as the main progression evidence against criteria for task fulfilment, use of sources, organisation and language, often with a short reflective commentary on the process.",
      "stages": [
        "foundation",
        "pre-sessional-ug",
        "pre-sessional-pg"
      ],
      "topicIds": [
        "ges.extended-source-based-project",
        "inf.research-question",
        "inf.search-strategies",
        "inf.source-evaluation",
        "ntk.notes-from-reading",
        "src.paraphrasing",
        "src.voice-boundaries",
        "syn.synthesis-concept",
        "par.integrating-evidence",
        "arg.position",
        "ess.body-organisation",
        "cit.accuracy-consistency",
        "edt.global-revision",
        "fbk.acting-on-feedback"
      ]
    },
    {
      "id": "integrated-reading-into-writing-exam",
      "name": "Integrated reading-into-writing exam",
      "description": "Under timed conditions, learners read two or three short academic texts on a common issue and write a summary, a summary–response or a short source-based essay that answers a set question. Scripts are marked on task response, accurate and transformed use of the sources, organisation and language control, and the task is often a mid-course or end-of-course progression component.",
      "stages": [
        "foundation",
        "pre-sessional-ug",
        "pre-sessional-pg"
      ],
      "topicIds": [
        "syn.integrated-tasks",
        "wpr.task-analysis",
        "wpr.reading-to-write",
        "rdp.parsing-complex-sentences",
        "rdc.argument-identification",
        "ntk.notes-from-reading",
        "src.summarising-passage",
        "src.paraphrasing",
        "src.reporting-verbs",
        "ess.thesis-statement",
        "ges.argumentative-essay",
        "exm.timed-writing",
        "grm.error-monitoring"
      ]
    },
    {
      "id": "seminar-discussion-assessment",
      "name": "Seminar discussion assessment",
      "description": "In small groups, learners discuss a question based on assigned readings that they have prepared in advance. They are assessed individually on how well they contribute ideas supported by the readings, build on and challenge others, manage turns and keep the discussion intelligible, usually against a seminar rubric with tutor and sometimes peer ratings.",
      "stages": [
        "foundation",
        "pre-sessional-ug",
        "pre-sessional-pg",
        "in-sessional-ug",
        "in-sessional-pgt"
      ],
      "topicIds": [
        "sem.preparation",
        "sem.turn-taking",
        "sem.opinions",
        "sem.agreeing-disagreeing",
        "sem.building-on-others",
        "sem.citing-in-speech",
        "sem.questions-clarification",
        "sem.summarising-discussion",
        "sta.spoken-stance",
        "rdc.critical-response",
        "arg.oral-argument"
      ]
    },
    {
      "id": "academic-presentation",
      "name": "Academic presentation",
      "description": "Learners give a 10–15-minute individual or group presentation, often reporting their project or explaining data to a mixed academic audience, followed by questions. It is assessed on structure and signposting, use of visuals and evidence, delivery and intelligibility, and the handling of questions.",
      "stages": [
        "foundation",
        "pre-sessional-ug",
        "pre-sessional-pg",
        "in-sessional-ug",
        "in-sessional-pgt"
      ],
      "topicIds": [
        "prs.purpose-audience",
        "prs.structure",
        "prs.openings",
        "prs.signposting",
        "prs.slide-design",
        "prs.explaining-visuals",
        "dat.describing-trends",
        "prs.speaking-from-notes",
        "prs.delivery-voice",
        "prn.thought-groups",
        "prn.prominence",
        "prs.rehearsal-timing",
        "prs.handling-questions"
      ]
    },
    {
      "id": "listening-into-note-making",
      "name": "Listening-into-note-making task",
      "description": "Learners watch a recorded or live lecture of 15–25 minutes, make notes in a format of their choice, and then use the notes to answer comprehension questions or write a short summary or response. The task is marked on the accuracy and selectivity of the information retrieved and on how well the notes capture the lecture's main points, organisation and the lecturer's stance.",
      "stages": [
        "foundation",
        "pre-sessional-ug",
        "pre-sessional-pg"
      ],
      "topicIds": [
        "lis.pre-listening-preparation",
        "lis.lecture-structure",
        "lis.lecture-discourse-markers",
        "lis.relevance-markers",
        "lis.main-points",
        "lis.speaker-stance",
        "lis.connected-speech",
        "ntk.selecting-content",
        "ntk.note-formats",
        "ntk.abbreviations-symbols",
        "ntk.lecture-notes",
        "ntk.reviewing-notes"
      ]
    },
    {
      "id": "reflective-learning-portfolio",
      "name": "Reflective learning portfolio",
      "description": "Learners compile a portfolio of learning logs, goal-setting records, annotated drafts and feedback responses across the course, ending with a reflective commentary on how their academic language and practices have developed. It is assessed on the quality of evidence and of reflection: specific goals, honest self-evaluation against criteria and concrete action taken on feedback, rather than on language accuracy alone.",
      "stages": [
        "foundation",
        "pre-sessional-ug",
        "pre-sessional-pg",
        "in-sessional-ug"
      ],
      "topicIds": [
        "lrn.self-regulation",
        "lrn.goal-setting",
        "lrn.reflective-logs",
        "lrn.language-learning-strategies",
        "voc.deliberate-learning-systems",
        "ges.reflective-writing",
        "fbk.feedback-literacy",
        "fbk.marking-criteria",
        "fbk.self-peer-assessment",
        "fbk.acting-on-feedback",
        "grm.error-monitoring"
      ]
    },
    {
      "id": "research-proposal",
      "name": "Research or dissertation proposal",
      "description": "Learners write a proposal (1,500–3,000 words at taught postgraduate level, longer for doctoral admission or first-year plans) that defines a problem and gap, states aims and questions, justifies an approach and sets out ethics, feasibility and a timeline. It is judged by a supervisor, module team or panel on whether the project is worthwhile, answerable and achievable, and on how well the literature is used to justify it.",
      "stages": [
        "pre-sessional-pg",
        "in-sessional-pgt",
        "pgr"
      ],
      "topicIds": [
        "grp.project-proposal",
        "res.research-proposal",
        "inf.research-question",
        "res.research-questions",
        "rds.research-article-navigation",
        "syn.gaps-tensions",
        "res.gap-niche",
        "res.introductions-cars",
        "res.methods",
        "dss.methodology-justification",
        "int.research-integrity",
        "wpr.managing-long-projects"
      ]
    },
    {
      "id": "literature-review-chapter",
      "name": "Literature review chapter",
      "description": "Learners write the literature review of a master's dissertation or doctoral thesis: a thematically organised, evaluative synthesis of the field that builds towards the gap their own study addresses. It is assessed by supervisors and examiners on coverage and selection, critical evaluation, synthesis rather than summary, and how convincingly it justifies the study's questions and design.",
      "stages": [
        "in-sessional-pgt",
        "pgr"
      ],
      "topicIds": [
        "inf.citation-chaining",
        "rdc.literature-mapping",
        "syn.synthesis-matrix",
        "syn.thematic-grouping",
        "syn.relating-sources",
        "syn.gaps-tensions",
        "syn.synthesis-paragraphs",
        "cit.citation-functions",
        "sta.evaluating-others-language",
        "sta.dialogic-positioning",
        "res.gap-niche",
        "res.literature-review",
        "dig.reference-managers"
      ]
    },
    {
      "id": "confirmation-progression-review",
      "name": "Confirmation or progression review",
      "description": "Doctoral researchers submit a confirmation, upgrade or annual progression report, typically with a revised proposal, a literature review or sample chapter, a thesis plan and a timeline, and then discuss it with a review panel. The panel judges the coherence, feasibility and likely contribution of the project and the candidate's ability to explain and defend their choices orally.",
      "stages": [
        "pgr"
      ],
      "topicIds": [
        "res.progression-review",
        "res.research-proposal",
        "res.thesis-macrostructure",
        "res.theoretical-framework",
        "dss.methodology-justification",
        "res.contribution",
        "res.writing-productivity",
        "res.supervision",
        "prs.research-presentations",
        "arg.oral-argument",
        "sta.authorial-voice"
      ]
    }
  ],
  "templates": [
    {
      "id": "pre-sessional-6wk-b2plus-pg",
      "name": "6-week pre-sessional for taught master's entry (B2+)",
      "stage": "pre-sessional-pg",
      "entryBand": "B2+",